OWNER,TABLE_NAME,FEATURE_DATATSET,DATASET_TYPE,NAME,CONTACT_PER,ABSTRACT,PURPOSE,USE_LIMIT,SEARCH_KEYS,MOD_DATE,ITEM_COUNT
HYDROGRAPHY,DFIRM_PA_Philadelphia,Floodplains,Polygon,"FEMA DFIRM Flood Hazard Zones - Philadelphia County, Pennsylvania",,"*** Philadelphia County DFIRM Effective Date: 1/17/2007 ***This shapefile is based on the original Philadelphia County Flood Hazard Zones shapefile (s_fld_haz_ar.shp) that was downloaded from the FEMA Map Service Center's Express Document Delivery (EDDie) webpage in Feb 2014. EDDie is an online facility provided by the Map Service Center for use by federal, state, and local government employees and FEMA contractors.Aside from being re-named and re-projected, an attribute field (ZONE_DESC) has been added to aid in symbolizing the 100 and 500-year flood hazard zones.The Digital Flood Insurance Rate Map (DFIRM) Database depicts flood risk information and supporting data used to develop the risk data. The primary risk classifications used are the 1-percent-annual-chance flood event, the 0.2-percent-annual-chance flood event, and areas of minimal flood risk. The DFIRM Database is derived from Flood Insurance Studies (FISs), previously published Flood Insurance Rate Maps (FIRMs), flood hazard analyses performed in support of the FISs and FIRMs, and new mapping data, where available. The FISs and FIRMs are published by the Federal Emergency Management Agency (FEMA). The specifications for the horizontal control of DFIRM data files are consistent with those required for mapping at a scale of 1:12,000.","The FIRM is the basis for floodplain management, mitigation, and insurance activities for the National Flood Insurance Program (NFIP). Insurance applications include enforcement of the mandatory purchase requirement of the Flood Disaster Protection Act, which ""... requires the purchase of flood insurance by property owners who are being assisted by Federal programs or by Federally supervised, regulated or insured agencies or institutions in the acquisition or improvement of land facilities located or to be located in identified areas having special flood hazards,"" Section 2 (b) (4) of the Flood Disaster Protection Act of 1973. In addition to the identification of Special Flood Hazard Areas (SFHAs), the risk zones shown on the FIRMs are the basis for the establishment of premium rates for flood coverage offered through the NFIP. The DFIRM Database presents the flood risk information depicted on the FIRM in a digital format suitable for use in electronic mapping applications. The DFIRM database is a subset of the Digital FIS database that serves to archive the information collected during the FIS.","The hardcopy FIRM and DFIRM and the accompanying FISs are the official designation of SFHAs and Base Flood Elevations (BFEs) for the NFIP. For the purposes of the NFIP, changes to the flood risk information published by FEMA may only be performed by FEMA and through the mechanisms established in the NFIP regulations (44 CFR Parts 59-78). These digital data are produced in conjunction with the hardcopy FIRMs and generally matches the hardcopy map exactly. However the hardcopy flood maps and flood profiles are the authoritative documents for the NFIP. Acknowledgement of FEMA would be appreciated in products derived from these data.",,20150414,890
HYDROGRAPHY,DFIRM_PA_Delaware,Floodplains,Polygon,"FEMA DFIRM Flood Hazard Zones - Delaware County, Pennsylvania",,"*** Delaware County DFIRM Effective Date: 11/18/2009 ***This shapefile is based on the original Delaware County Flood Hazard Zones shapefile (s_fld_haz_ar.shp) that was downloaded from the FEMA Map Service Center's Express Document Delivery (EDDie) webpage in Feb 2014. EDDie is an online facility provided by the Map Service Center for use by federal, state, and local government employees and FEMA contractors.Aside from being re-named and re-projected, an attribute field (ZONE_DESC) has been added to aid in symbolizing the 100 and 500-year flood hazard zones.The Digital Flood Insurance Rate Map (DFIRM) Database depicts flood risk information and supporting data used to develop the risk data. The primary risk classifications used are the 1-percent-annual-chance flood event, the 0.2-percent-annual-chance flood event, and areas of minimal flood risk. The DFIRM Database is derived from Flood Insurance Studies (FISs), previously published Flood Insurance Rate Maps (FIRMs), flood hazard analyses performed in support of the FISs and FIRMs, and new mapping data, where available. The FISs and FIRMs are published by the Federal Emergency Management Agency (FEMA). The specifications for the horizontal control of DFIRM data files are consistent with those required for mapping at a scale of 1:12,000.","The FIRM is the basis for floodplain management, mitigation, and insurance activities for the National Flood Insurance Program (NFIP). Insurance applications include enforcement of the mandatory purchase requirement of the Flood Disaster Protection Act, which ""... requires the purchase of flood insurance by property owners who are being assisted by Federal programs or by Federally supervised, regulated or insured agencies or institutions in the acquisition or improvement of land facilities located or to be located in identified areas having special flood hazards,"" Section 2 (b) (4) of the Flood Disaster Protection Act of 1973. In addition to the identification of Special Flood Hazard Areas (SFHAs), the risk zones shown on the FIRMs are the basis for the establishment of premium rates for flood coverage offered through the NFIP. The DFIRM Database presents the flood risk information depicted on the FIRM in a digital format suitable for use in electronic mapping applications. The DFIRM database is a subset of the Digital FIS database that serves to archive the information collected during the FIS.","The hardcopy FIRM and DFIRM and the accompanying FISs are the official designation of SFHAs and Base Flood Elevations (BFEs) for the NFIP. For the purposes of the NFIP, changes to the flood risk information published by FEMA may only be performed by FEMA and through the mechanisms established in the NFIP regulations (44 CFR Parts 59-78). These digital data are produced in conjunction with the hardcopy FIRMs and generally matches the hardcopy map exactly. However the hardcopy flood maps and flood profiles are the authoritative documents for the NFIP. Acknowledgement of FEMA would be appreciated in products derived from these data.",,20150414,2209
HYDROGRAPHY,DFIRM_NJ_Monmouth,Floodplains,Polygon,"FEMA DFIRM Flood Hazard Zones - Monmouth County, New Jersey",,"*** Monmouth County DFIRM Effective Date: 9/25/09 ***This shapefile was downloaded from the FEMA Map Service Center's Express Document Delivery (EDDie) webpage in Feb 2014. EDDie is an online facility provided by the Map Service Center for use by federal, state, and local government employees and FEMA contractors.Aside from being re-named and re-projected, an attribute field (ZONE_DESC) has been added to aid in symbolizing the 100 and 500-year flood hazard zones.The Digital Flood Insurance Rate Map (DFIRM) Database depicts flood risk information and supporting data used to develop the risk data. The primary risk classifications used are the 1-percent-annual-chance flood event, the 0.2-percent-annual-chance flood event, and areas of minimal flood risk. The DFIRM Database is derived from Flood Insurance Studies (FISs), previously published Flood Insurance Rate Maps (FIRMs), flood hazard analyses performed in support of the FISs and FIRMs, and new mapping data, where available. The FISs and FIRMs are published by the Federal Emergency Management Agency (FEMA). The specifications for the horizontal control of DFIRM data files are consistent with those required for mapping at a scale of 1:12,000.","The FIRM is the basis for floodplain management, mitigation, and insurance activities for the National Flood Insurance Program (NFIP). Insurance applications include enforcement of the mandatory purchase requirement of the Flood Disaster Protection Act, which ""... requires the purchase of flood insurance by property owners who are being assisted by Federal programs or by Federally supervised, regulated or insured agencies or institutions in the acquisition or improvement of land facilities located or to be located in identified areas having special flood hazards,"" Section 2 (b) (4) of the Flood Disaster Protection Act of 1973. In addition to the identification of Special Flood Hazard Areas (SFHAs), the risk zones shown on the FIRMs are the basis for the establishment of premium rates for flood coverage offered through the NFIP. The DFIRM Database presents the flood risk information depicted on the FIRM in a digital format suitable for use in electronic mapping applications. The DFIRM database is a subset of the Digital FIS database that serves to archive the information collected during the FIS.","The hardcopy FIRM and DFIRM and the accompanying FISs are the official designation of SFHAs and Base Flood Elevations (BFEs) for the NFIP. For the purposes of the NFIP, changes to the flood risk information published by FEMA may only be performed by FEMA and through the mechanisms established in the NFIP regulations (44 CFR Parts 59-78). These digital data are produced in conjunction with the hardcopy FIRMs and generally matches the hardcopy map exactly. However the hardcopy flood maps and flood profiles are the authoritative documents for the NFIP. Acknowledgement of FEMA would be appreciated in products derived from these data.",,20150414,5047
HYDROGRAPHY,NJ_Dams,Infrastructure,Point,HYDROGRAPHY.NJ_Dams,Nick Agnoli,"This theme locates the dams in the state of New Jersey that are listed in the records of the NJ DEP Dam Safety Section. This includes high, significant and low hazard dams as well as 2x unclassified dams and dams which have been removed.",To show where dams are situated and to label them based on their hazard classification,"New Jersey Department of Environmental Protection (NJDEP) Data Distribution Agreement I. I. Description of Data to be Provided. The data provided herein are distributed subject to the following conditions and restrictions. SUBJECT DATA LAYERS For all data contained herein, NJDEP makes no representations of any kind, including, but not limited to, the warranties of merchantability or fitness for a particular use, nor are any such warranties to be implied with respect to the digital data layers furnished hereunder. NJDEP assumes no responsibility to maintain them in any manner or form. II. Terms of Agreement 1. 1. Digital data received from the NJDEP are to be used solely for internal purposes in the conduct of daily affairs. 2. 2. The data are provided, as is, without warranty of any kind and the user is responsible for understanding the accuracy limitations of all digital data layers provided herein, as documented in the accompanying cross-reference files (see Section 1.14 CROSS-REFERENCE). Any reproduction or manipulation of the above data must ensure that the coordinate reference system remains intact. 3. 3. Digital data received from the NJDEP may not be reproduced or redistributed for use by anyone without first obtaining written permission from the NJDEP. This clause is not intended to restrict distribution of printed mapped information produced from the digital data. 4. 4. Any maps, publications, reports, or other documents produced as a result of this project that utilize NJDEP digital data will credit the NJDEP's Geographic Information System (GIS) as the source of the data with the following credit/disclaimer: ""This (map/publication/report) was developed using New Jersey Department of Environmental Protection Geographic Information System digital data, but this secondary product has not been verified by NJDEP and is not state-authorized."" 5. Users shall require any independent contractor, hired to undertake work that will utilize digital data obtained from the NJDEP, to agree not to use, reproduce, or redistribute NJDEP GIS data for any purpose other than the specified contractual work. All copies of NJDEP GIS data utilized by an independent contractor will be required to be returned to the original user at the close of such contractual work. Users hereby agree to abide by the use and reproduction conditions specified above and agree to hold any independent contractor to the same terms. By using data provided herein, the user acknowledges that terms and conditions have been read and that the user is bound by these criteria. The user is responsible for understanding the accuracy limitations of this digital data as delineated in the following accuracy reports. This data may not be reproduced or redistributed without the written consent of the NJDEP. Any maps, publications, reports, or other documents produced as a result of this project that utilize NJDEP digital data will credit the NJDEP's Geographic Information System (GIS) as the source of the data with the following credit/disclaimer: ""This (map/publication/report) was developed using New Jersey Department of Environmental Protection Geographic Information System digital data, but this secondary product has not been verified by NJDEP and is not state-authorized.""","dams, dam safety, flood, reservoir, spillway, sdf, hazard, high hazard, significant hazard, low hazard, unclassified, historical dams",20150414,1645
HYDROGRAPHY,PA_Streams,Streams,Polyline,PADEP_STREAMS_DesUse,Angela Bransteitter,"National Hydrography Dataset NHDFlowline layer with a spatial representation of designated water uses defined in Title 25 Environmental Protection, Department of Environmental Protection, Chapter 93, Water Quality Standards. The Pennsylvania Code just cited provides a list of all streams or watersheds (basins) in the state along with their associated designated water uses. This GIS layer displays these uses spatially on an interactive stream map. Public users can drill down to locations on the map to view and map the designated uses of the water bodies of interest. The layer can also be used in conjunction with other spatially referenced data for spatial analyses.","Water quality criteria are used to protect designated water uses, such as fish and aquatic life, recreation, and water supply. Designated uses establish the reason for protection and the water quality criteria define the criteria required to protect that benchmark. Use designations and water quality criteria together, constitute Pennsylvania Water Quality Standards as defined in Title 25 Environmental Protection, Department of Environmental Protection, Chapter 93. This GIS stream layer (which is not part of the Water Quality Standards) is offered to provide a spatial representation of the Aquatic Life Use Tiers contained in the portion of the Pennsylvania Code referenced above. These spatial representations are intended to supplement the Water Quality Standards but should not be substituted for the official version of the standards found in the Pennsylvania Code.","DISCLAIMER: These data, offered to provide a spatial representation of standards contained in the Pennsylvania Code. Title 25 Environmental Protection, Department of Environmental Protection, Chapter 93, Water Quality Standards, are current and accurate to the best of our knowledge and are appropriately updated as required. These data should not be substituted for the official version of the standards in the Pennsylvania code. Commonwealth of Pennsylvania Department of Environmental Protection Disclaimer for Data The user shall save the Commonwealth harmless from any suits, claims, or actions arising out of the use of the data files or accompanying documentation, or arising out of any defects in the datafiles or accompanying documentation. The Commonwealth excludes any and all implied warranties and makes no warranty or representation with respect to the data files or accompanying documentation, including quality, performance, merchantability, or fits for a particular purpose. These data files and documentation are provided ""as is"" and the user assumes the entire risk as to their quality and performance.","inlandWaters, Chapter 93, Chap 93, Chap. 93, Water Quality Standards, stream, streams, river, rivers, water, creek, creeks, CWF, cold water, cold water fishes, cold water fish, fish, fishes, EV, Exceptional Value Waters, Exceptional Value, TSF, Trout, Trout Stocking, WWF, warm water, Warm Water Fishes, Warm Water Fish, HQ, High Quality, High Quality Waters, Migratory Fishes, Water Use, Special Protection, Streams Chapter 93, Designated Use",20150414,112504
HYDROGRAPHY,NJ_Streams,Streams,Polyline,HYDROGRAPHY.NJ_Streams,,"NOTE: This metadata file contains information for Flowlines delineated for NJ from 2002 color infrared (CIR) imagery with attributes extracted from the National Hydrography Dataset (NHD) . Digitizing of this data was initially done by Aerial Information Systems, Inc., Redlands, CA, under direction of the New Jersey Department of Environmental Protection (NJDEP), Bureau of Geographic Information System (BGIS). Conflation of USGS 1:24,000 High resolution NHD attributes was done by Data Enhancement Services, LLC (DES) partnered with Civil Solutions. This statewide conflation of NHD High resolution information was completed in 2010. All QA/QC was done by NJDEP, Bureau of GIS and USGS. This represents a subset of the statewide extract for NJ dated August 25, 2010. Note: This shapefile was generated from a SDE feature class layer. Some attribute names over 10 characters were truncated during this process. This metadata file has been modified to accommodate truncated field names.","The data set will provide stream information for regulators, planners, and others interested in hydrography data. The use of the NHD data layers in hydrologic analyses will provide a means of monitoring ""the health of the citizens and ecosystems of New Jersey"" through the use of diverse applications. This data set is intended to serve as a resource for analysis rather than regulatory delineations. The NJDEP may change the line work based on more in depth analysis and field inspection for regulatory purposes. NJDEP/BGIS is a stewardship partner with USGS in the development of Local resolution data which is NHD compliant.","New Jersey Department of Environmental Protection (NJDEP) Data Distribution Agreement I. Description of Data to be Provided. The data provided herein are distributed subject to the following conditions and restrictions: SUBJECT DATA LAYERS For all data contained herein, NJDEP makes no representations of any kind, including, but not limited to, the warranties of merchantability or fitness for a particular use, nor are any such warranties to be implied with respect to the digital data layers furnished hereunder. NJDEP assumes no responsibility to maintain them in any manner or form. II.Terms of Agreement 1. Digital data received from the NJDEP are to be used solely for internal purposes in the conduct of daily affairs. 2. The data are provided, as is, without warranty of any kind and the user is responsible for understanding the accuracy limitations of all digital data layers provided herein, as documented in the accompanying cross-reference files (see SUPPLEMENTAL INFORMATION). Any reproduction or manipulation of the above data must ensure that the coordinate reference system remains intact. 3. Digital data received from the NJDEP may not be reproduced or redistributed for use by anyone without first obtaining written permission from the NJDEP. This clause is not intended to restrict distribution of printed mapped information produced from the digital data. 4. Any maps, publications, reports, or other documents produced as a result of this project that utilize NJDEP digital data will credit the NJDEP's Geographic Information System (GIS) as the source of the data with the following credit/disclaimer: ""This (map/publication/report) was developed using New Jersey Department of Environmental Protection Geographic Information System digital data, but this secondary product has not been verified by NJDEP and is not state-authorized."" 5. Users shall require any independent contractor, hired to undertake work that will utilize digital data obtained from the NJDEP, to agree not to use, reproduce, or redistribute NJDEP GIS data for any purpose other than the specified contractual work. All copies of NJDEP GIS data utilized by an independent contractor will be required to be returned to the original user at the close of such contractual work. Users hereby agree to abide by the use and reproduction conditions specified above and agree to hold any independent contractor to the same terms. By using data provided herein, the user acknowledges that terms and conditions have been read and that the user is bound by these criteria.","Stream, Flowline, River, Water body, water quality, watersheds, watershed management areas, NHD, NJDEP, Hydrography, Stream / River, Lake / Pond, Canal / Ditch, Reservoir, Spring / Seep, Swamp / Marsh, Artificial Path, Reach Code, WBD, Watershed Boundary Dataset, inlandWaters, NHD",20150414,256859
HYDROGRAPHY,State_Streams,Streams,Polyline,State_Streams_n,,No variable,No variable,No variable,"FWHydrography, Hydrography, Stream / River, Lake / Pond, Canal / Ditch, Reservoir, Spring / Seep, Swamp / Marsh, Artificial Path, Reach Code",20150420,889354
HYDROGRAPHY,DVRPC_Streams,Streams,Polyline,Streams of the DVRPC Region (to be used at regional scale),,Streams of the DVRPC Region (to be used at regional scale)Names last updated May 2014,To be used for planning purposes.,"This data is made available for planning purposes only by the Delaware Valley Regional Planning Commission (DVRPC) as a public service and is provided AS IS for you to use at your own risk. DVRPC makes no representation of warranty of any kind, expressed or implied, with respect to this information. Please credit DVRPC as the source when using this data.",,20150429,288
HYDROGRAPHY,Regional_Water_Bodies,WaterBodies,Polygon,HYDROGRAPHY.Regional_Water_Bodies,,Major Water Bodies in the DVRPC Region and extended region. To be used for cartographic purposes only,Water Bodies,"This data is made available for planning purposes only by the Delaware Valley Regional Planning Commission (DVRPC) as a public service and is provided AS IS for you to use at your own risk. DVRPC makes no representation of warranty of any kind, expressed or implied, with respect to this information. Please credit DVRPC as the source when using this data.",,20150818,60
HYDROGRAPHY,State_Water_Bodies,WaterBodies,Polygon,State_Water_Bodies,,No variable,No variable,No variable,"FWHydrography, Hydrography, Stream / River, Lake / Pond, Canal / Ditch, Reservoir, Spring / Seep, Swamp / Marsh, Artificial Path, Reach Code",20150430,312995
HYDROGRAPHY,State_HUC_10,Watersheds,Polygon,National Hydrography Dataset (NHD) HUC 10 Watersheds,,"Layers of geospatial data include geographic names, hydrography, and other selected map features.",This map depicts geographic features on the surface of the earth. It is a general purpose map for users who are not GIS experts. One intended purpose is to support emergency response at all levels of government. The geospatial data in this map are from selected National Map data holdings and other government sources.,"None. However, users should be aware that temporal changes may have occurred since this data set was collected and that some parts of this data may no longer represent actual surface conditions. Users should not use this data for critical applications without a full awareness of its limitations. Acknowledgment of the U.S. Geological Survey would be appreciated for products derived from these data.",,20150414,857
HYDROGRAPHY,State_HUC_12,Watersheds,Polygon,National Hydrography Dataset (NHD) HUC 12 Watersheds,,"Layers of geospatial data include geographic names, hydrography, and other selected map features.",This map depicts geographic features on the surface of the earth. It is a general purpose map for users who are not GIS experts. One intended purpose is to support emergency response at all levels of government. The geospatial data in this map are from selected National Map data holdings and other government sources.,"None. However, users should be aware that temporal changes may have occurred since this data set was collected and that some parts of this data may no longer represent actual surface conditions. Users should not use this data for critical applications without a full awareness of its limitations. Acknowledgment of the U.S. Geological Survey would be appreciated for products derived from these data.",,20150414,4125
