OWNER,TABLE_NAME,FEATURE_DATATSET,DATASET_TYPE,NAME,CONTACT_PER,ABSTRACT,PURPOSE,USE_LIMIT,SEARCH_KEYS,MOD_DATE,ITEM_COUNT
FREIGHT,port_pts,,Point,Port Terminals (points),,The DVRPC port terminals data set represents the landside and pier data for active commercial marine terminals in the Delaware Valley. The data shows piers consolidated by operator along with the landside terminal facilities. Data varies by bulk and general cargo facility. Data was compiled by DVRPC using port terminal marketing materials and outreach with terminal operators.,Point locations of port terminals in the DVRPC region. For planning purposes.,"This data is made available for planning purposes only by the Delaware Valley Regional Planning Commission (DVRPC) as a public service and is provided AS IS for you to use at your own risk. DVRPC makes no representation of warranty of any kind, expressed or implied, with respect to this information. Please credit DVRPC as the source when using this data.",REQUIRED: Common-use word or phrase used to describe the subject of the data set.,20150803,34
FREIGHT,product_pipelines,,Table,Energy Product Pipelines,,Energy product pipeline details for national pipelines serving the DVRPC region.,Energy product pipelines in the DVRPC region. For planning purposes.,"This data is made available for planning purposes only by the Delaware Valley Regional Planning Commission (DVRPC) as a public service and is provided AS IS for you to use at your own risk. DVRPC makes no representation of warranty of any kind, expressed or implied, with respect to this information. Please credit DVRPC as the source when using this data.",,20150731,7
FREIGHT,rail_mileposts,,Point,Rail Mileposts,,Rail milepost for the DVRPC freight rail network. Improved version of FRA database.,INCOMPLETE!! DO NOT USE. Rail milepost for the DVRPC freight rail network. For planning purposes.,"This data is made available for planning purposes only by the Delaware Valley Regional Planning Commission (DVRPC) as a public service and is provided AS IS for you to use at your own risk. DVRPC makes no representation of warranty of any kind, expressed or implied, with respect to this information. Please credit DVRPC as the source when using this data.",,20150803,26
FREIGHT,rail_yard_pts,,Point,Freight Rail Yard (points),,"The DVRPC Freight Rail Yards data layer was developed to provide information about key interchange, sorting, and storage yards in the region. The yard data was created utilizing a combination of outreach to rail operators and DVRPC mapping.",Point locations of freight rail yards in the DVRPC region. For planning purposes.,"This data is made available for planning purposes only by the Delaware Valley Regional Planning Commission (DVRPC) as a public service and is provided AS IS for you to use at your own risk. DVRPC makes no representation of warranty of any kind, expressed or implied, with respect to this information. Please credit DVRPC as the source when using this data.",,20150803,21
FREIGHT,rail_yards,,Polygon,Freight Rail Yards,,"The DVRPC Freight Rail Yards data layer was developed to provide information about key interchange, sorting, and storage yards in the region. The yard data was created utilizing a combination of outreach to rail operators and DVRPC mapping.",General-purpose use for identifying location and owner details about facilities.,"This data is made available for planning purposes only by the Delaware Valley Regional Planning Commission (DVRPC) as a public service and is provided AS IS for you to use at your own risk. DVRPC makes no representation of warranty of any kind, expressed or implied, with respect to this information. Please credit DVRPC as the source when using this data.",,20141229,23
FREIGHT,river,,Polygon,Navigable River,,The DVRPC navigable river layer is a polygon layer representing the extents of the Delaware and Schulykill rivers that are designated for commercial traffic. Each waterway is segmented by the appropriate channel and reaches division. NOAA data was utilized to populate the segments with related navigation data.,Commercial navigable river for the DVRPC region. For planning purposes.,"This data is made available for planning purposes only by the Delaware Valley Regional Planning Commission (DVRPC) as a public service and is provided AS IS for you to use at your own risk. DVRPC makes no representation of warranty of any kind, expressed or implied, with respect to this information. Please credit DVRPC as the source when using this data.",REQUIRED: Common-use word or phrase used to describe the subject of the data set.,20150803,47
FREIGHT,river_channel,,Polyline,Navigable River (centerline),,Centerline of navigable channel. Based on NOAA navigation charts.,Linear system representing the navigable river in the DVRPC region. For planning purposes.,"This data is made available for planning purposes only by the Delaware Valley Regional Planning Commission (DVRPC) as a public service and is provided AS IS for you to use at your own risk. DVRPC makes no representation of warranty of any kind, expressed or implied, with respect to this information. Please credit DVRPC as the source when using this data.",,20150803,42
FREIGHT,river_crossings,,Point,Major River Crossings,,"Includes highway and rail river crossing inventory for the DVRPC region.The DVRPC Highway River Crossing data layer was developed to identify key bridges in the region that span major rivers and can be considered crucial to interstate commerce. These bridge were mapped as point features identifying the center point location of the facility. Additional inputs were on the facilities was based on Department of Transportation, Turnpike Commission and Bridge Commission data.The DVRPC Railroad River Crossing data layer was developed to identify key bridges in the region that span major rivers and can be considered crucial to interstate commerce. These bridge were mapped as point features identifying the center point location of the facility. Additional inputs were on the facilities was based on Department of Transportation and rail carrier data.",Includes highway and rail river crossing inventory for the DVRPC region.,"This data is made available for planning purposes only by the Delaware Valley Regional Planning Commission (DVRPC) as a public service and is provided AS IS for you to use at your own risk. DVRPC makes no representation of warranty of any kind, expressed or implied, with respect to this information. Please credit DVRPC as the source when using this data.",,20150803,24
FREIGHT,river_ndc_links,,Polyline,Navigation Data Center Links,,Based on the NDC waterway link model. Limited to DVRPC facilities and modified to reflect local conditions.,NDC navigation links for the DVRPC region. For planning purposes.,"This data is made available for planning purposes only by the Delaware Valley Regional Planning Commission (DVRPC) as a public service and is provided AS IS for you to use at your own risk. DVRPC makes no representation of warranty of any kind, expressed or implied, with respect to this information. Please credit DVRPC as the source when using this data.",,20150803,16
FREIGHT,truck_parking,,Polygon,Truck Parking ,,"Truck Parking facilities are essential to the freight system to accommodate overnight parking to support long haul truck movement in, out and through the region. In the DVRPC region there three types of truck parking facilities: private truck stops, service plazas, and rest areas. This data layer was assembled by DVRPC utilizing directory listing for these facilities and related property boundaries. Additional data was acquired through on site surveys of facilities.",Truck parking facilities in the DVRPC region. For planning purposes.,"This data is made available for planning purposes only by the Delaware Valley Regional Planning Commission (DVRPC) as a public service and is provided AS IS for you to use at your own risk. DVRPC makes no representation of warranty of any kind, expressed or implied, with respect to this information. Please credit DVRPC as the source when using this data.",,20150803,14
FREIGHT,truck_parking_pts,,Point,Trucking Parking (points),,"Truck Parking facilities are essential to the freight system to accommodate overnight parking to support long haul truck movement in, out and through the region. In the DVRPC region there three types of truck parking facilities: private truck stops, service plazas, and rest areas. This data layer was assembled by DVRPC utilizing directory listing for these facilities and related property boundaries. Additional data was acquired through on site surveys of facilities.",Point locations of truck parking facilities in the DVRPC region. For planning purposes.,"This data is made available for planning purposes only by the Delaware Valley Regional Planning Commission (DVRPC) as a public service and is provided AS IS for you to use at your own risk. DVRPC makes no representation of warranty of any kind, expressed or implied, with respect to this information. Please credit DVRPC as the source when using this data.",REQUIRED: Common-use word or phrase used to describe the subject of the data set.,20150803,14
FREIGHT,SHRP2_Links,,Polyline,FREIGHT.SHRP2_Links,,No variable,No variable,No variable,,20150914,0
FREIGHT,airports,,Polygon,Airports,,The DVRPC airports data set includes the property areas of all commercial and reliever airports in the Delaware Valley. Annual operations are extracted from FAA records or based upon the DVRPC counting program.,Airports in the DVRPC region. For planning purposes.,"This data is made available for planning purposes only by the Delaware Valley Regional Planning Commission (DVRPC) as a public service and is provided AS IS for you to use at your own risk. DVRPC makes no representation of warranty of any kind, expressed or implied, with respect to this information. Please credit DVRPC as the source when using this data.",,20150803,11
FREIGHT,ports,,Polygon,Port Terminals,,The DVRPC port terminals data set represents the landside and pier data for active commercial marine terminals in the Delaware Valley. The data shows piers consolidated by operator along with the landside terminal facilities. Data varies by bulk and general cargo facility. Data was compiled by DVRPC using port terminal marketing materials and outreach with terminal operators.,Port terminals in the DVRPC region. For planning purposes.,"This data is made available for planning purposes only by the Delaware Valley Regional Planning Commission (DVRPC) as a public service and is provided AS IS for you to use at your own risk. DVRPC makes no representation of warranty of any kind, expressed or implied, with respect to this information. Please credit DVRPC as the source when using this data.",,20150803,34
FREIGHT,ship_call_activity,,Table,Ship Call Activity Data,,No variable,Ship call data for the ports and anchorages in the DVRPC region.,No variable,,20150803,206
FREIGHT,freight_center_pts,,Point,Freight Centers (points),,"The DVRPC Freight Centers data file is based on an internal classification system for geographic areas with a high concentration of freight generating land uses. This data set has been developed through comprehensive local research on firm location and land uses. Currently the file contains three tiers: Mega, Major and Intermediate.",DVRPC freight center point locations. For planning purposes.,"This data is made available for planning purposes only by the Delaware Valley Regional Planning Commission (DVRPC) as a public service and is provided AS IS for you to use at your own risk. DVRPC makes no representation of warranty of any kind, expressed or implied, with respect to this information. Please credit DVRPC as the source when using this data.",REQUIRED: Common-use word or phrase used to describe the subject of the data set.,20150803,44
FREIGHT,intermodal,,Polygon,Intermodal Rail Yard,,"Intermodal rail terminals provide key connections between the nation freight rail network and local shippers and receivers. The DVRPC intermodal rail terminals data set represents four types of intermodal terminals: trans-flow, transload, auto-intermodal and intermodal container.",Intermodal rail terminals in the DVRPC region. For planning purposes.,"This data is made available for planning purposes only by the Delaware Valley Regional Planning Commission (DVRPC) as a public service and is provided AS IS for you to use at your own risk. DVRPC makes no representation of warranty of any kind, expressed or implied, with respect to this information. Please credit DVRPC as the source when using this data.",REQUIRED: Common-use word or phrase used to describe the subject of the data set.,20150803,12
FREIGHT,nhs_connector_pts,,Point,NHS Connectors (points),,"National Highway System (NHS) connectors are roads, which may be either state or locally owned, which connect intermodal facilities to major highways on the National Highway System. The NHS Connectors in this data layer are officially designated NHS freight connectors that serve any of three types of facilities: intermodal rail facility, port, and/or airport. These routes were digitized based on DVRPC's street centerline data set to correspond with the officially designated NHS Connector routes.",NHS connector point locations for the DVRPC region. For planning purposes.,"This data is made available for planning purposes only by the Delaware Valley Regional Planning Commission (DVRPC) as a public service and is provided AS IS for you to use at your own risk. DVRPC makes no representation of warranty of any kind, expressed or implied, with respect to this information. Please credit DVRPC as the source when using this data.",,20150803,11
FREIGHT,pipelines,,Polyline,Pipelines,,"The pipelines shapefile was digitized from Ai graphic files, where individual lines were traced from PDFs of individual county maps provided by the National Pipeline Mapping System(NPMS). Due to the sensitive nature of this data, the maps that were made available through NPMS are not precisely accurate and are intended for use at a county or regional scale.",Pipeline data for the DVRPC region.,No variable,REQUIRED: Common-use word or phrase used to describe the subject of the data set.,20150803,66
FREIGHT,energy_storage,,Table,Energy Storage Facilities,,Energy product storage facilities in the DVRPC region. Table repsenting linked facilities and capacities.,Energy storage facilities in the DVRPC region. For planning purposes,"This data is made available for planning purposes only by the Delaware Valley Regional Planning Commission (DVRPC) as a public service and is provided AS IS for you to use at your own risk. DVRPC makes no representation of warranty of any kind, expressed or implied, with respect to this information. Please credit DVRPC as the source when using this data.",,20151027,3
﻿GEOLOGY,NJ_Bedrock_Geology,Geology,Polygon,GEOLOGY.NJ_Bedrock_Geology,Ron Pristas,No variable,No variable,No variable,"bedrock, geology, faults, folds, dikes, lithology, geoscientificInformation",20150414,3563
GEOLOGY,PA_Bedrock_Geology,Geology,Polygon,GEOLOGY.PA_Bedrock_Geology,Christine E. Miles,"Two digital data sets, one for geologic units and faults and the other for dikes, have been prepared for Pennsylvania. The data sets were digitized primarily from the artwork used for the 1980 ""Geologic Map of Pennsylvania"" (Berg, T. M., Edmunds, W. E., Geyer, A. R., and others, compilers, 1980, Geologic map of Pennsylvania: Pennsylvania Geological Survey, 4th ser., Map 1, scale 1:250,000) and from source materials used for that map. Many of the source materials had been published as page-sized maps and were digitized from this published paper copy (Berg, T. M., and Dodge, C. M., 1981, Atlas of preliminary geologic quadrangle maps of Pennsylvania: Pennsylvania Geological Survey, 4th ser., Map 61, scale approx. 1:62,500). The other source materials consist of unpublished and published maps at various scales. It was beyond the scope of the project to incorporate revisions that had been made to the geologic units since the 1980 map was compiled; however, some updates to formational contacts, faults, and dikes, as well as to geologic nomenclature and ages, were incorporated where the revisions could be easily made. The 1980 Pennsylvania state geologic map (Berg and others, 1980) shows the areal distribution of 194 bedrock geologic units. The units range in geologic age from Quaternary to Precambrian and encompass a wide variety of lithologies. The map was compiled and published in a transverse mercator projection at 1:250,000 scale. The two digital data sets include 195 geologic units, which, for the most part, closely correspond to those shown on the 1980 map. The data sets were prepared using ArcInfo software and are provided in a geographic coordinate system (units in decimal degrees). Although it is possible to portray digital data at any scale, the geologic formational contacts, faults, and dikes represented in these data sets are not intended to be used at any scale finer than 1:250,000. The polygon attributes in the data set for geologic contacts and faults include unit number, map symbol, name, age, and three lithology categories that represent the general lithologic makeup of each geologic unit. Each arc (line) in the data set is attributed as one or more of the three general categories of contact, fault, or border. Contact lines are attributed according to the type of contact shown on the 1980 map (solid, dashed, queried, or arbitrary). Fault lines are similarly attributed (solid, dashed, or queried). Borders are attributed as either state boundaries, quadrangle boundaries, or the shoreline of Lake Erie. The data set for dikes consists of arcs attributed with unit number, map symbol, name, age, lithology, and type of dike (solid or dashed). It is anticipated that the digital data sets will be used for a variety of regional or statewide geographic-information-system applications, including water-resource and environmental studies, conservation and ecosystem management, mineral exploration, and regional land use planning and development.","The hard-copy ""Geologic Map of Pennsylvania"" (Berg and others, 1980) is the most current, available source showing the bedrock geology of the entire state and has had widespread use for regional studies. The Pennsylvania Bureau of Topographic and Geologic Survey (PaGS), responding to numerous requests from federal and state government agencies and the private sector, has converted the geology represented on the 1980 map to a digital format. The purpose is to make the geology of the state available as a ""seamless"" coverage for use in regional spatial analyses and other digital applications.","The data for the geologic units, faults, and dikes may be used provided that credit for the original (unaltered) data sets is given to the Pennsylvania Bureau of Topographic and Geologic Survey, Department of Conservation and Natural Resources. Users shall clearly indicate the source of the data. Users who modify the data in any way are obligated to describe the types of modifications they have made, including modifications to hard-copy maps. Users are not to misrepresent Pennsylvania Bureau of Topographic and Geologic Survey (PaGS) data sets, nor to imply that changes they (users) have made were approved by the PaGS. These data sets are not designed for use as a primary regulatory tool in permitting and siting decisions. This is public information and, as such, it may be used a reference source and may be interpreted by organizations, agencies, units of government, or others based on needs; however, each user is responsible for the appropriate application of the data. Federal, state, or local regulatory bodies are not to reassign to the Bureau of Topographic and Geologic Survey any authority for the decisions they make using these data sets.  The geologic units depicted on the published map are, in many cases, taken from source maps that were based on aerial photograph interpretation and limited, or no, field checking. Users are cautioned that, because of the nature and scale of the compilation and the source materials used, the geologic contacts, faults, and dikes may be off their true locations by several hundred feet locally. Users are also cautioned that, because the lithologies of many geologic units vary widely both laterally and vertically, the representation of the lithology of the geologic units based only on the dominant lithology (LITH1 in the polygon attribute table) is in many cases inappropriate, even at a regional scale.  The data sets are not meant for site-specific analysis or for use at finer (i.e., larger, more detailed) scales. Users are not to misrepresent the data sets by presenting them at scales for which they are not intended, nor to imply that presentation at such scales is approved by the PaGS.  The data sets are not to be redistributed for profit. Please refer to the section on Distribution_Liability for additional constraints.","Geology, Geologic map, Bedrock geology, Areal geology, Surface geology, Geologic units, Formations, Formational contacts, Faults, Dikes, Lithologies, Rock types, Quaternary, Tertiary, Cretaceous, Jurassic, Triassic, Permian, Pennsylvanian, Mississippian, Devonian, Silurian, Ordovician, Cambrian, Lower Paleozoic, Precambrian, geoscientificinformation",20150414,14478
GEOLOGY,Philadelphia_Soils,Soils,Polygon,GEOLOGY.Philadelphia_Soils,,"This data set is a digital soil survey and generally is the most detailed level of soil geographic data developed by the National Cooperative Soil Survey. The information was prepared by digitizing maps, by compiling information onto a planimetric correct base and digitizing, or by revising digitized maps using remotely sensed and other information. This data set consists of georeferenced digital map data and computerized attribute data. The map data are in a soil survey area extent format and include a detailed, field verified inventory of soils and miscellaneous areas that normally occur in a repeatable pattern on the landscape and that can be cartographically shown at the scale mapped. A special soil features layer (point and line features) is optional. This layer displays the location of features too small to delineate at the mapping scale, but they are large enough and contrasting enough to significantly influence use and management. The soil map units are linked to attributes in the National Soil Information System relational database, which gives the proportionate extent of the component soils and their properties.",SSURGO depicts information about the kinds and distribution of soils on the landscape. The soil map and data used in the SSURGO product were prepared by soil scientists as part of the National Cooperative Soil Survey.,"The U.S. Department of Agriculture, Natural Resources Conservation Service, should be acknowledged as the data source in products derived from these data. This data set is not designed for use as a primary regulatory tool in permitting or citing decisions, but may be used as a reference source. This is public information and may be interpreted by organizations, agencies, units of government, or others based on needs; however, they are responsible for the appropriate application. Federal, State, or local regulatory bodies are not to reassign to the Natural Resources Conservation Service any authority for the decisions that they make. The Natural Resources Conservation Service will not perform any evaluations of these maps for purposes related solely to State or local regulatory programs. Photographic or digital enlargement of these maps to scales greater than at which they were originally mapped can cause misinterpretation of the data. If enlarged, maps do not show the small areas of contrasting soils that could have been shown at a larger scale. The depicted soil boundaries, interpretations, and analysis derived from them do not eliminate the need for onsite sampling, testing, and detailed study of specific sites for intensive uses. Thus, these data and their interpretations are intended for planning purposes only. Digital data files are periodically updated. Files are dated, and users are responsible for obtaining the latest version of the data.","soil survey, soils, Soil Survey Geographic, SSURGO",20150414,906
