OWNER,TABLE_NAME,FEATURE_DATATSET,DATASET_TYPE,NAME,CONTACT_PER,ABSTRACT,PURPOSE,USE_LIMIT,SEARCH_KEYS,MOD_DATE,ITEM_COUNT
DEMOGRAPHICS,ZCTA_2010,Census_Geographies_DVRPC,Polygon,"ZIP Code Tabulation Areas, 2010 (TIGER)",,"Subset for DVPRC Region The TIGER/Line Files are shapefiles and related database files (.dbf) that are an extract of selected geographic and cartographic information from the U.S. Census Bureau's Master Address File / Topologically Integrated Geographic Encoding and Referencing (MAF/TIGER) Database (MTDB). The MTDB represents a seamless national file with no overlaps or gaps between parts, however, each TIGER/Line File is designed to stand alone as an independent data set, or they can be combined to cover the entire nation. ZIP Code Tabulation Areas (ZCTAs) are approximate area representations of U.S. Postal Service (USPS) ZIP Code service areas that the Census Bureau creates to present statistical data from Census 2000. The Census Bureau creates ZCTAs for the United States, Puerto Rico, American Samoa, Guam, the Commonwealth of the Northern Mariana Islands, and the U.S. Virgin Islands for the 2010 Census. Data users should not use ZCTAs to identify the official USPS ZIP Code for mail delivery. The USPS makes periodic changes to ZIP Codes to support more efficient mail delivery. For the 2010 Census, ZCTAs should more accurately represent the actual ZIP Codes at the time of their delineation than they did for Census 2000. This is because that before the tabulation blocks, which the ZCTAs are built from, were delineated for the 2010 Census, the Census Bureau undertook the process of inserting lines that could be used as 2010 Census tabulation block boundaries, and these lines split polygons where the result would be that a significant number of addresses would occur on either one or both sides of the line associated with a single ZIP Code. Each 2010 Census tabulation block that contains addresses is assigned to a single ZCTA, usually to the ZCTA that reflects the most frequently occurring ZIP Code for the addresses within that tabulation block. As a result, ZIP Codes associated with address ranges found in the Address Ranges relationship file may not always match the ZCTA. Blocks that do not contain addresses but are completely surrounded by a single ZCTA (enclaves) are assigned to the surrounding ZCTA. A ZCTA may not exist for every USPS ZIP Code. Some ZIP Codes may not have a matching ZCTA because too few addresses were associated with the specific ZIP Code or the ZIP Code was not the most frequently occurring ZIP Code within any of the blocks were it exists. The Census Bureau uses the addresses stored within MTDB to delineate ZCTAs, and at the time of the 2010 Census the MTDB primarily included addresses for residential or at least potentially residential structures, so ZCTAs representing only non-residential structures are infrequent. Also, in each tabulation block, if a choice existed between using a potential city-style mail delivery ZIP Code for an address or a post office box ZIP Code, the city-style mail delivery ZIP Code was preferred for the 2010 Census ZCTA delineation. The Census Bureau identifies 5-digit ZCTAs using a five-character numeric code that represents the most frequently occurring USPS ZIP Code within that ZCTA, and this code may contain leading zeros.","In order for others to use the information in the Census MAF/TIGER database in a geographic information system (GIS) or for other geographic applications, the Census Bureau releases to the public extracts of the database in the form of TIGER/Line Shapefiles.","The TIGER/Line Shapefile products are not copyrighted however TIGER/Line and Census TIGER are registered trademarks of the U.S. Census Bureau. These products are free to use in a product or publication, however acknowledgement must be given to the U.S. Census Bureau as the source. The boundary information in the TIGER/Line Shapefiles are for statistical data collection and tabulation purposes only; their depiction and designation for statistical purposes does not constitute a determination of jurisdictional authority or rights of ownership or entitlement and they are not legal land descriptions.Coordinates in the TIGER/Line shapefiles have six implied decimal places, but the positional accuracy of these coordinates is not as great as the six decimal places suggest.","boundaries, Nation, Polygon, ZIP Code Tabulation Area, ZCTA, Zip Code",20150414,358
DEMOGRAPHICS,SchoolDist_Unified,Census_Geographies_DVRPC,Polygon,Unified School Districts (TIGER),,"The TIGER/Line shapefiles and related database files (.dbf) are an extract of selected geographic and cartographic information from the U.S. Census Bureau's Master Address File / Topologically Integrated Geographic Encoding and Referencing (MAF/TIGER) Database (MTDB). The MTDB represents a seamless national file with no overlaps or gaps between parts, however, each TIGER/Line shapefile is designed to stand alone as an independent data set, or they can be combined to cover the entire nation. School Districts are single-purpose administrative units within which local officials provide public educational services for the area's residents. The Census Bureau obtains the boundaries, names, local education agency codes, grade ranges, and school district levels for school districts from State officials for the primary purpose of providing the U.S. Department of Education with estimates of the number of children in poverty within each school district. This information serves as the basis for the Department of Education to determine the annual allocation of Title I funding to States and school districts. TIGER/Line Shapefiles include separate shapefiles for elementary, secondary and unified school districts. The school district boundaries are those in effect for the 2011-2012 school year.","In order for others to use the information in the Census MAF/TIGER database in a geographic information system (GIS) or for other geographic applications, the Census Bureau releases to the public extracts of the database in the form of TIGER/Line Shapefiles.","The TIGER/Line Shapefile products are not copyrighted however TIGER/Line and Census TIGER are registered trademarks of the U.S. Census Bureau. These products are free to use in a product or publication, however acknowledgement must be given to the U.S. Census Bureau as the source. The boundary information in the TIGER/Line Shapefiles are for statistical data collection and tabulation purposes only; their depiction and designation for statistical purposes does not constitute a determination of jurisdictional authority or rights of ownership or entitlement and they are not legal land descriptions.Coordinates in the TIGER/Line shapefiles have six implied decimal places, but the positional accuracy of these coordinates is not as great as the six decimal places suggest.","boundaries, State or equivalent entity, Polygon, School District, Unified School District",20150413,131
DEMOGRAPHICS,StateUrbanAreas_2012,Census_Geographies_DVRPC,Polygon,"Urban Areas, 2012 (TIGER)",,"The TIGER/Line shapefiles and related database files (.dbf) are an extract of selected geographic and cartographic information from the U.S. Census Bureau's Master Address File / Topologically Integrated Geographic Encoding and Referencing (MAF/TIGER) Database (MTDB). The MTDB represents a seamless national file with no overlaps or gaps between parts, however, each TIGER/Line shapefile is designed to stand alone as an independent data set, or they can be combined to cover the entire nation. After each decennial census, the Census Bureau delineates urban areas that represent densely developed territory, encompassing residential, commercial, and other nonresidential urban land uses. In general, this territory consists of areas of high population density and urban land use resulting in a representation of the ""urban footprint."" There are two types of urban areas: urbanized areas (UAs) that contain 50,000 or more people and urban clusters (UCs) that contain at least 2,500 people, but fewer than 50,000 people (except in the U.S. Virgin Islands and Guam which each contain urban clusters with populations greater than 50,000). Each urban area is identified by a 5-character numeric census code that may contain leading zeroes.","In order for others to use the information in the Census MAF/TIGER database in a geographic information system (GIS) or for other geographic applications, the Census Bureau releases to the public extracts of the database in the form of TIGER/Line Shapefiles.","The TIGER/Line Shapefile products are not copyrighted however TIGER/Line and Census TIGER are registered trademarks of the U.S. Census Bureau. These products are free to use in a product or publication, however acknowledgement must be given to the U.S. Census Bureau as the source. The boundary information in the TIGER/Line Shapefiles are for statistical data collection and tabulation purposes only; their depiction and designation for statistical purposes does not constitute a determination of jurisdictional authority or rights of ownership or entitlement and they are not legal land descriptions.Coordinates in the TIGER/Line shapefiles have six implied decimal places, but the positional accuracy of these coordinates is not as great as the six decimal places suggest.","boundaries, Nation, Polygon, Urban Area, UA, Urbanized Areas, Urban Cluster, UC",20150414,12
DEMOGRAPHICS,SchoolDist_Secondary,Census_Geographies_DVRPC,Polygon,Secondary School Districts (TIGER),,"The TIGER/Line shapefiles and related database files (.dbf) are an extract of selected geographic and cartographic information from the U.S. Census Bureau's Master Address File / Topologically Integrated Geographic Encoding and Referencing (MAF/TIGER) Database (MTDB). The MTDB represents a seamless national file with no overlaps or gaps between parts, however, each TIGER/Line shapefile is designed to stand alone as an independent data set, or they can be combined to cover the entire nation. School Districts are single-purpose administrative units within which local officials provide public educational services for the area's residents. The Census Bureau obtains the boundaries, names, local education agency codes, grade ranges, and school district levels for school districts from State officials for the primary purpose of providing the U.S. Department of Education with estimates of the number of children in poverty within each school district. This information serves as the basis for the Department of Education to determine the annual allocation of Title I funding to States and school districts. TIGER/Line Shapefiles include separate shapefiles for elementary, secondary and unified school districts. The school district boundaries are those in effect for the 2011-2012 school year.","In order for others to use the information in the Census MAF/TIGER database in a geographic information system (GIS) or for other geographic applications, the Census Bureau releases to the public extracts of the database in the form of TIGER/Line Shapefiles.","The TIGER/Line Shapefile products are not copyrighted however TIGER/Line and Census TIGER are registered trademarks of the U.S. Census Bureau. These products are free to use in a product or publication, however acknowledgement must be given to the U.S. Census Bureau as the source. The boundary information in the TIGER/Line Shapefiles are for statistical data collection and tabulation purposes only; their depiction and designation for statistical purposes does not constitute a determination of jurisdictional authority or rights of ownership or entitlement and they are not legal land descriptions.Coordinates in the TIGER/Line shapefiles have six implied decimal places, but the positional accuracy of these coordinates is not as great as the six decimal places suggest.","boundaries, State or equivalent entity, Polygon, School District, Secondary School District",20150413,11
DEMOGRAPHICS,TAZ_2010,Census_Geographies_DVRPC,Polygon,"2010 Transportation Analysis Zones (TAZs), TIGER",,"The TIGER/Line Files are shapefiles and related database files (.dbf) that are an extract of selected geographic and cartographic information from the U.S. Census Bureau's Master Address File / Topologically Integrated Geographic Encoding and Referencing (MAF/TIGER) Database (MTDB). The MTDB represents a seamless national file with no overlaps or gaps between parts, however, each TIGER/Line File is designed to stand alone as an independent data set, or they can be combined to cover the entire nation. Traffic analysis zones (TAZs) are basic spatial units of analysis facilitating the ability of transportation planners to forecast changes in commuting patterns, trip volumes, and modes of travel, and to develop plans to meet the changing demands for transportation facilities and capacities. Each TAZ represents an area containing similar kinds of land use and commuter travel.","In order for others to use the information in the Census MAF/TIGER database in a geographic information system (GIS) or for other geographic applications, the Census Bureau releases to the public extracts of the database in the form of TIGER/Line Shapefiles.","The TIGER/Line Shapefile products are not copyrighted however TIGER/Line and Census TIGER are registered trademarks of the U.S. Census Bureau. These products are free to use in a product or publication, however acknowledgement must be given to the U.S. Census Bureau as the source. The boundary information in the TIGER/Line Shapefiles are for statistical data collection and tabulation purposes only; their depiction and designation for statistical purposes does not constitute a determination of jurisdictional authority or rights of ownership or entitlement and they are not legal land descriptions.Coordinates in the TIGER/Line shapefiles have six implied decimal places, but the positional accuracy of these coordinates is not as great as the six decimal places suggest.",,20150611,3158
DEMOGRAPHICS,TAZ_2010_MCDAligned,,Polygon,"2010 TAZ Boundaries, Aligned to DVRPC MCDs, Extended Region",,"TAZ layer for extended region, aligned with MCDs in DVRPC region using Census block boundaries to divide zones within municipalities (updated in Feb 2015)The following changes were made in Jan 2015:Zone 14024 incorporated into Zone 14014. (Quakertown)Zone 18005 incorporated into Zone 18008. (Trenton)",No variable,"This data is made available for planning purposes only by the Delaware Valley Regional Planning Commission (DVRPC) as a public service and is provided AS IS for you to use at your own risk. DVRPC makes no representation of warranty of any kind, expressed or implied, with respect to this information. Please credit DVRPC as the source when using this data.",,20150514,3158
DEMOGRAPHICS,ACS_Profile_09_13_Tract,DVRPC_Demographics,Polygon,"ACS Profiles, 5 year data, 2009-2013 for Tracts in DVRPC Region",,"Selected data from the Census Bureau's 2009-2013 ACS dataset for the municipalities and tracts in the DVRPC Region. American Community Survey (ACS) provides detailed demographic, social, economic, commuting and housing statistics based on continuous survey data collection. Summary tables compiled with 5-year data are available for all places and have approximately 20,000 variables from 900 tabulations. The published Census statistics have been recompiled by DVRPC, with new field names.Field NameDescriptionSource TableTotCommTotal CommutersB08301AutoCar, truck, or van:B08301DrvAloneDrove aloneB08301CarpoolCarpooled:B08301Carpl2In 2-person carpoolB08301Carpl3In 3-person carpoolB08301Carpl4In 4-person carpoolB08301Carpl5or6In 5- or 6-person carpoolB08301Carpl7plsIn 7-or-more-person carpoolB08301PublTranPublic transportation (excluding taxicab):B08301BusTrollBus or trolley busB08301StCarTrollStreetcar or trolley car (carro publico in Puerto Rico)B08301SubElSubway or elevatedB08301RRRailroadB08301FerryFerryboatB08301TaxiTaxicabB08301MotorcycMotorcycleB08301BikeBicycleB08301WalkWalkedB08301OtherOther meansB08301TelecommWorked at homeB08301PopOver16Population 16 years and overDP03TotEmpInForceIn labor forceDP03UnempPctPercent non in labor forceDP03TimeToWkMean Travel Time to WorkDP03MedHHIMedian household income (dollars)DP03PctFoodSNAPPercentage of households with Food Stamp/SNAP benefits in the past 12 monthsDP03PctNoInsPercentage of civilian noninstitutionalized population with no health insurance coverageDP03PctFamBelPovPercentage of families and people whose income is the past 12 months is below the poverty levelDP03TotHUTotal housing unitsDP04HUOccOccupied housing unitsDP04HUVacantVacant housing unitsDP04NoVehNHouseholds with no vehicles availableDP04NoVehPPercentage of households with no vehicles availableDP04OneVehNHouseholds with 1 vehicle availableDP04OneVehPPercentage of households with 1 vehicle availableDP04TwoVehNHouseholds with 2 vehicles availableDP04TwoVehPPercentage of households with 2 vehicles availableDP04ThrPlsVehNHouseholds with 3 or more vehicles available DP04ThrPlsVehPPercentage of households with 3 or more vehicles available DP04TotPopTotal PopulationDP05TotMaleMale PopulationDP05TotFemFemale PopulationDP05AllWhiteTotal WhiteDP05AllWhitePctPercent WhiteDP05AllBlkTotal BlackDP05AllBlkPctPercent BlackDP05AllAmerInTotal American Indian and Alaska NativeDP05AllAmerInPctPercent American Indian and Alaska NativeDP05AllAsianTotal AsianDP05AllAsianPctPercent AsianDP05AllNatHITotal Native Hawaiian and Other Pacific IslanderDP05AllNatHIPctPercent Native Hawaiian and Other Pacific IslanderDP05HispTotTotal HispanicB03003*HispPctPercent Hispaniccalculated**tract-level data in DP05 was erroneous, downloaded B03003 to replace dataSources of tract boundaries: US Census Bureau. The TIGER/Line Files are shapefiles and related database files (.dbf) that are an extract of selected geographic and cartographic information from the U.S. Census Bureau's Master Address File / Topologically Integrated Geographic Encoding and Referencing (MAF/TIGER) Database (MTDB). The MTDB represents a seamless national file with no overlaps or gaps between parts, however, each TIGER/Line File is designed to stand alone as an independent data set, or they can be combined to cover the entire nation. Census tracts are small, relatively permanent statistical subdivisions of a county or equivalent entity, and were defined by local participants as part of the 2010 Census Participant Statistical Areas Program. The Census Bureau delineated the census tracts in situations where no local participant existed or where all the potential participants declined to participate. The primary purpose of census tracts is to provide a stable set of geographic units for the presentation of census data and comparison back to previous decennial censuses. Census tracts generally have a population size between 1,200 and 8,000 people, with an optimum size of 4,000 people. When first delineated, census tracts were designed to be homogeneous with respect to population characteristics, economic status, and living conditions. The spatial size of census tracts varies widely depending on the density of settlement. Physical changes in street patterns caused by highway construction, new development, and so forth, may require boundary revisions. In addition, census tracts occasionally are split due to population growth, or combined as a result of substantial population decline. Census tract boundaries generally follow visible and identifiable features. They may follow legal boundaries such as minor civil division (MCD) or incorporated place boundaries in some States and situations to allow for census tract-to-governmental unit relationships where the governmental boundaries tend to remain unchanged between censuses. State and county boundaries always are census tract boundaries in the standard census geographic hierarchy. In a few rare instances, a census tract may consist of noncontiguous areas. These noncontiguous areas may occur where the census tracts are coextensive with all or parts of legal entities that are themselves noncontiguous. For the 2010 Census, the census tract code range of 9400 through 9499 was enforced for census tracts that include a majority American Indian population according to Census 2000 data and/or their area was primarily covered by federally recognized American Indian reservations and/or off-reservation trust lands; the code range 9800 through 9899 was enforced for those census tracts that contained little or no population and represented a relatively large special land use area such as a National Park, military installation, or a business/industrial park; and the code range 9900 through 9998 was enforced for those census tracts that contained only water area, no land area.","ACS Profiles, 5 year data, 2009-2013 for Tracts in DVRPC Region. For planning purposes","This data is made available for planning purposes only by the Delaware Valley Regional Planning Commission (DVRPC) as a public service and is provided AS IS for you to use at your own risk. DVRPC makes no representation of warranty of any kind, expressed or implied, with respect to this information. Please credit DVRPC as the source when using this data.",,20150618,1379
DEMOGRAPHICS,Census2010_DemoProfile_County,DVRPC_Demographics,Polygon,2010 Census Data Profile for MCDs in DVRPC Region,,"Pop20102010 Total Population Und18Population Under 18Btw1864Population Age 18-64Ov62Population Age 62 and overOv65Population Age 65 and overMedAgeMedian AgeOneRacePopulation of one RaceWhiteWhite AloneBlkBlack or African American AloneAmerinAmerican Indian and Alaska Native AloneAsianAsian AlonePacIsNative Hawaiian and other Pacific Islander AloneOthRceSome Other Race AloneTwoRcePopulation of Two or more RacesHispHispanic or LatinoMexMexicanPRPuerto RicanCubCubanOthHisOther Hispanic or LatinoNonHisNot Hispanic or LatinoTotHHTotal HouseholdsFamHHFamily HouseholdsNonFamNonfamily HouseholdsHHSzAverage Household SizeFamSzAverage Family SizeHHKidsFamily Households with own children under 18HusWfeHusband-Wife FamilyHsWfKdHusband-Wife Family with own children under 18SngMomFemale householder, no husband presentSngMKdFemale householder, no husband present with own children under 18OccHUTotal Occupied Housing UnitsOwOcHUOwner-Occupied Housing UnitsRnOcHURenter-Occupied Housing UnitsPop2k2000 Total Population PopChg% Population Change 2000-2010 ",2010 Census Profiles with selected data categories by County in DVRPC Region. For planning purposes,"This data is made available for planning purposes only by the Delaware Valley Regional Planning Commission (DVRPC) as a public service and is provided AS IS for you to use at your own risk. DVRPC makes no representation of warranty of any kind, expressed or implied, with respect to this information. Please credit DVRPC as the source when using this data.",,20160131,9
