OWNER,TABLE_NAME,FEATURE_DATATSET,DATASET_TYPE,NAME,CONTACT_PER,ABSTRACT,PURPOSE,USE_LIMIT,SEARCH_KEYS,MOD_DATE,ITEM_COUNT
﻿BIOTA,NJ_VernalHabitat,,Polygon,NJ Vernal Habitat (Landscape Project),Peter Winkler,"In 2001, ENSP partnered with Rutgers University Center for Remote Sensing and Spatial Analysis (CRSSA) to develop a method for mapping potential vernal pools throughout New Jersey. Through an on-screen visual interpretation of digital orthophotography, CRSSA identified over 13,000 potential pools throughout the state. A subset of these pools was field verified and confirmed, with an 88% accuracy rate, to meet the physical characteristics to qualify as a vernal pool (Lathrop et al. 2005). In accordance with N.J.A.C. 7:7A-1.4, the term ""vernal habitat"" includes a vernal pool - or the area of ponding - plus any freshwater wetlands adjacent to the vernal pool. Vernal habitat areas mapped in the Landscape Project rely upon those data developed by the DEP and CRSSA to identify sites that should be field checked for possible identification as vernal habitats areas. DEP staff is in the process of field-verifying these pools. The Department also maps vernal habitat areas based upon on-the-ground assessment of sites not captured by the CRSSA mapping. The Landscape Project includes all of the CRSAA-identified sites, as well as sites identified by on-the-ground reconnaissance, categorized as either ""potential vernal habitat areas"" or ""vernal habitat areas"" as defined below: "" Potential vernal habitat area - These are areas identified by CRSSA as possibly containing a vernal pool that meets the criteria of a ""vernal habitat"" pursuant to N.J.A.C. 7:7A-1.4. These sites include sites that have been field inspected and have been found to meet the physical characteristics of a vernal habitat, but for which biological criteria have not yet been measured, as well as sites that have not been checked by DEP staff. "" Vernal habitat areas - These are areas that contain pools that have been field-verified by the Department and have been determined to meet both the physical and biological characteristics of a vernal habitat in accordance with N.J.A.C. 7:7A-1.4. All areas mapped as ""potential vernal habitat areas"" and ""vernal habitat areas"" are derived from a point location estimated to be the center of an individual vernal pool and include all areas within 300 meters of the point. Note that the occurrence area is not intended to suggest or correspond with any specific regulatory requirement. Rather, the area added around the point accounts for variations in the size of individual vernal pools, variations in the width of freshwater wetlands adjacent to the pool, plus adjacent habitats sufficient to include the estimated home range for vernal pool obligate species. If there is an overlap between areas mapped around two or more nearby points, the boundaries are conjoined to generate contiguous patches. If the resulting patch contains areas mapped as ""vernal habitat area"" and areas mapped as ""potential vernal habitat areas,"" the entire patch is labeled as a ""vernal habitat area.""","The Landscape Project was designed to provide users with peer-reviewed, scientifically sound information that transparently documents threatened and endangered species habitat.  Landscape Project data are easily accessible and can be integrated with the planning, protection and land management programs of non-government organizations and private landowners and at every level of government- federal, state, county and municipal.  Landscape maps and overlays provide a basis for proactive planning, such as the development of local habitat protection ordinances, zoning to protect critical wildlife areas, management guidelines for imperiled species conservation on public and private lands, and land acquisition projects.  Most importantly, the information that is readily available in the Landscape Project can be used for planning purposes before any actions such as proposed development, resource extraction (e.g. timber harvests) or conservation measures occur. The maps help increase predictability for local planners, environmental commissions, and developers and help facilitate local land use decisions that appropriately site and balance development and habitat protection.  The Landscape Project maps allow the regulated public to anticipate potential environmental regulation in an area and provide some level of assurance regarding areas where endangered, threatened or species of special concern are not likely to occur, affording predictability to the application and development process.  Thus, Landscape Project maps can be used proactively by regulators, planners and the regulated public in order to minimize conflict and protect species.  This minimizes time and money spent attempting to resolve after-the-fact endangered and threatened species issues.","This data set is a product of the Landscape Project, a pro-active, ecosystem-level approach to the long-term protection of imperiled and priority species and their important habitats in New Jersey. New Jersey Department of Environmental Protection (NJDEP) Data Distribution Agreement I. Description of Data to be Provided. The data provided herein are distributed subject to the following conditions and restrictions: SUBJECT DATA LAYERS For all data contained herein, NJDEP makes no representations of any kind, including, but not limited to, the warranties of merchantability or fitness for a particular use, nor are any such warranties to be implied with respect to the digital data layers furnished hereunder. NJDEP assumes no responsibility to maintain them in any manner or form. II. Terms of Agreement 1. Digital data received from the NJDEP are to be used solely for internal purposes in the conduct of daily affairs. 2. The data are provided, as is, without warranty of any kind and the user is responsible for understanding the accuracy limitations of all digital data layers provided herein, as documented in the accompanying cross-reference files (see Section 1.14 CROSS-REFERENCE). Any reproduction or manipulation of the above data must ensure that the coordinate reference system remains intact. 3. Digital data received from the NJDEP may not be reproduced or redistributed for use by anyone without first obtaining written permission from the NJDEP. This clause is not intended to restrict distribution of printed mapped information produced from the digital data. 4. Any maps, publications, reports, or other documents produced as a result of this project that utilize NJDEP digital data will credit the NJDEP's Geographic Information System (GIS) and Site Remediation Program as the source of the data with the following credit/disclaimer: ""This (map/publication/report) was developed using New Jersey Department of Environmental Protection Geographic Information System digital data, but this secondary product has not been verified by NJDEP and is not state-authorized."" 5. Users shall require any independent contractor, hired to undertake work that will utilize digital data obtained from the NJDEP, to agree not to use, reproduce, or redistribute NJDEP GIS data for any purpose other than the specified contractual work. All copies of NJDEP GIS data utilized by an independent contractor will be required to be returned to the original user at the close of such contractual work. Users hereby agree to abide by the use and reproduction conditions specified above and agree to hold any independent contractor to the same terms. By using data provided herein, the user acknowledges that terms and conditions have been read and that the user is bound by these criteria.","biota, environment, inlandWaters, oceans, Conservation, Ecology, Ecosystem, Environment, Exposure, Marine, Natural Resources, Water, Landscape",20150413,3242
BIOTA,NJ_NatHeritSites,,Polygon,Natural Heritage Priority Sites,,"*DOWNLOADED AUGUST, 2007. THIS IS THE 6/5/07 UPDATE* The Natural Heritage Priority Sites Coverage was created to identify critically important areas to conserve New Jersey's biological diversity, with particular emphasis on rare plant species and ecological communities. Natural Heritage Priority Sites are based on analysis of information in the New Jersey Natural Heritage Database. However, these sites do not cover all the known habitat for endangered and threatened species in New Jersey. If information is needed on whether or not endangered or threatened species have been documented from a particular piece of land, a Natural Heritage Database search can be requested by contacting the Office of Natural Lands Management. The Natural Heritage Priority Sites coverage is a valuable tool which can be used by individuals and agencies concerned with the protection and management of land. However, the coverage was not developed for regulatory purposes, and should not be used as a substitute for the on-site surveys and Natural Heritage Database searches required by regulatory agencies.","Using the Natural Heritage Database, the Office of Natural Lands Management (ONLM) has identified 343 Natural Heritage Priority Sites, representing some of the best remaining habitat for rare species and rare ecological communities in the state. Although the primary focus of these sites is rare plant species and ecological communities, the DEP Endangered and Nongame Species Program also provided key information and assisted with the delineation of a number of the sites that encompass significant habitats for rare animals. These areas should be considered to be top priorities for the preservation of biological diversity in New Jersey. If these sites become degraded or destroyed, we may lose some of the unique components of our natural heritage. Natural Heritage Priority Site maps are used by individuals and agencies concerned with the protection and management of land. The maps have been used by municipalities preparing natural resource inventories, public and private conservation organizations preparing open space acquisition goals, land developers and consultants identifying environmentally sensitive lands, and public and private landowners developing land management plans. Natural Heritage Priority Sites contain some of the best and most viable occurrences of rare plant species and ecological communities, but they do not cover all the known habitat for these elements or most rare animal species in New Jersey. If information is needed on whether or not endangered or threatened species have been documented from a particular area, a Natural Heritage Database search can be requested by contacting the Office of Natural Lands Management at: Office of Natural Lands Management, Division of Parks and Forestry, NJ Department of Environmental Protection, P.O. Box 404, Trenton, NJ 08625-0404 Phone: 609-984-1339 Fax: 609-984-1427","Data Distribution Agreement (NJDEP) Agrees to abide by the terms and conditions of the following: I. Description of Data to be Provided The data provided herein are distributed subject to the following conditions and restrictions. Subject Data Layers For all data contained herein, (NJDEP) makes no representations of any kind, including, but not limited to, the warranties of merchantability or fitness for a particular use, nor are any such warranties to be implied with respect to the digital data layers furnished hereunder. NJDEP assumes no responsibility to maintain them in any manner or form. II. Terms of Agreement 1. Digital data received from the NJDEP are to be used solely for internal purposes in the conduct of daily affairs. 2. The data are provided, as is, without warranty of any kind and the user is responsible for understanding the accuracy limitations of all digital data layers provided herein, as documented in the accompanying Data Dictionary and Readme files. Any reproduction or manipulation of the above data must ensure that the coordinate reference system remains intact. 3. Digital data received from the NJDEP may not be reproduced or redistributed for use by anyone without first obtaining written permission from the NJDEP. This clause is not intended to restrict distribution of printed mapped information produced from the digital data. 4. Any maps, publications, reports, or other documents produced as a result of this project that utilize NJDEP digital data will credit the NJDEP's Geographic Information System (GIS) as the source of the data with the following credit/disclaimer: ""This (map/publication/report) was developed using New Jersey Department of Environmental Protection Geographic Information System digital data, but this secondary product has not been verified by NJDEP and is not state-authorized."" 5. Users shall require any independent contractor, hired to undertake work that will utilize digital data obtained from the NJDEP, to agree not to use, reproduce, or redistribute NJDEP GIS data for any purpose other than the specified contractual work. All copies of NJDEP GIS data utilized by an independent contractor will be required to be returned to the original user at the close of such contractual work. Users hereby agree to abide by the use and reproduction conditions specified above and agree to hold any independent contractor to the same terms. By using data provided herein, the user acknowledges that terms and conditions have been read and that the user is bound by these criteria.","NJDEP, Natural Heritage Priority Sites, Plant Species, Conservation, Biological Diversity, Ecological Communities, Priority Sites, Natural Heritage, Biodiversity, Endangered Species, environment",20150413,343
BIOTA,NJ_MusselHabitat,,Polyline,NJ Freshwater Mussel Habitat (Landscape Project),Peter Winkler,"DEP maintains a Stream Network data layer that is a subset of the USGS 1:24,000 high-resolution National Hydrography Dataset (NHD). In Version 3.1 of the Landscape Project, stream and water body centerlines from the NHD Streams 2002 data layer are used to represent freshwater mussel habitat. Water body centerline and stream centerline data are valued exclusively by freshwater mussel species occurrence areas while other aquatic species habitats are represented with polygons from the Species-Based Habitat layer. In order to form representative ""patches"" of habitat from the NHD Streams 2002 layer, centerlines were broken at the following points: The confluence of two or more streams The inflow/outflow of a water body Stretches of stream intersected by a mussel SOA are valued as habitat. All valued streams are buffered by 0.75 kilometers upstream and downstream. The 0.75 kilometer distance is chosen as a conservative buffer estimate because scientific literature, which is based largely upon larval transport by host fishes, indicates that if there are two occurrences within two kilometers of each other (assuming unsuitable habitat between), these occurrences should be considered as part of the same local population (NatureServe 2011). In the cases where stream buffers of separate occurrences of the same species met, either upstream or downstream, the stream segments between those occurrences are also valued for that species. In addition, in cases where dams are barriers the extent of stream valued was limited.","The Landscape Project was designed to provide users with peer-reviewed, scientifically sound information that transparently documents threatened and endangered species habitat.  Landscape Project data are easily accessible and can be integrated with the planning, protection and land management programs of non-government organizations and private landowners and at every level of government- federal, state, county and municipal.  Landscape maps and overlays provide a basis for proactive planning, such as the development of local habitat protection ordinances, zoning to protect critical wildlife areas, management guidelines for imperiled species conservation on public and private lands, and land acquisition projects.

Most importantly, the information that is readily available in the Landscape Project can be used for planning purposes before any actions such as proposed development, resource extraction (e.g. timber harvests) or conservation measures occur. The maps help increase predictability for local planners, environmental commissions, and developers and help facilitate local land use decisions that appropriately site and balance development and habitat protection.  The Landscape Project maps allow the regulated public to anticipate potential environmental regulation in an area and provide some level of assurance regarding areas where endangered, threatened or species of special concern are not likely to occur, affording predictability to the application and development process.  Thus, Landscape Project maps can be used proactively by regulators, planners and the regulated public in order to minimize conflict and protect species.  This minimizes time and money spent attempting to resolve after-the-fact endangered and threatened species issues.","This data set is a product of the Landscape Project, a pro-active, ecosystem-level approach to the long-term protection of imperiled and priority species and their important habitats in New Jersey. New Jersey Department of Environmental Protection (NJDEP) Data Distribution Agreement I. Description of Data to be Provided. The data provided herein are distributed subject to the following conditions and restrictions: SUBJECT DATA LAYERS For all data contained herein, NJDEP makes no representations of any kind, including, but not limited to, the warranties of merchantability or fitness for a particular use, nor are any such warranties to be implied with respect to the digital data layers furnished hereunder. NJDEP assumes no responsibility to maintain them in any manner or form. II. Terms of Agreement 1. Digital data received from the NJDEP are to be used solely for internal purposes in the conduct of daily affairs. 2. The data are provided, as is, without warranty of any kind and the user is responsible for understanding the accuracy limitations of all digital data layers provided herein, as documented in the accompanying cross-reference files (see Section 1.14 CROSS-REFERENCE). Any reproduction or manipulation of the above data must ensure that the coordinate reference system remains intact. 3. Digital data received from the NJDEP may not be reproduced or redistributed for use by anyone without first obtaining written permission from the NJDEP. This clause is not intended to restrict distribution of printed mapped information produced from the digital data. 4. Any maps, publications, reports, or other documents produced as a result of this project that utilize NJDEP digital data will credit the NJDEP's Geographic Information System (GIS) and Site Remediation Program as the source of the data with the following credit/disclaimer: ""This (map/publication/report) was developed using New Jersey Department of Environmental Protection Geographic Information System digital data, but this secondary product has not been verified by NJDEP and is not state-authorized."" 5. Users shall require any independent contractor, hired to undertake work that will utilize digital data obtained from the NJDEP, to agree not to use, reproduce, or redistribute NJDEP GIS data for any purpose other than the specified contractual work. All copies of NJDEP GIS data utilized by an independent contractor will be required to be returned to the original user at the close of such contractual work. Users hereby agree to abide by the use and reproduction conditions specified above and agree to hold any independent contractor to the same terms. By using data provided herein, the user acknowledges that terms and conditions have been read and that the user is bound by these criteria.","biota, environment, inlandWaters, oceans, Conservation, Ecology, Ecosystem, Environment, Exposure, Marine, Natural Resources, Water, Landscape",20150413,1066
